{
  "schema_version": "1.0.0",
  "supplier": {
    "state": "stated",
    "value": "Bramblewood Civil Supplies Pty Ltd",
    "raw": "Bramblewood Civil Supplies Pty Ltd"
  },
  "quote_number": {
    "state": "stated",
    "value": "BCS-26/1182",
    "raw": "BCS-26/1182"
  },
  "date": {
    "state": "stated",
    "value": "2026-10-17",
    "raw": "17/10/2026"
  },
  "currency": {
    "state": "stated",
    "value": "AUD",
    "raw": "AUD"
  },
  "line_items": [
    {
      "description": {
        "state": "stated",
        "value": "Pre-mix concrete 32MPa, 20mm agg.",
        "raw": "Pre-mix concrete 32MPa, 20mm agg."
      },
      "quantity": {
        "state": "stated",
        "value": "6.5",
        "raw": "6.5"
      },
      "unit": {
        "state": "stated",
        "value": "m3",
        "raw": "m³"
      },
      "unit_price": {
        "state": "stated",
        "value": "285.00",
        "raw": "$285.00"
      },
      "discount": {
        "state": "not_stated"
      },
      "line_total": {
        "state": "stated",
        "value": "1852.50",
        "raw": "$1,852.50"
      }
    },
    {
      "description": {
        "state": "stated",
        "value": "Reinforcing mesh SL82 6.0 x 2.4",
        "raw": "Reinforcing mesh SL82 6.0 x 2.4"
      },
      "quantity": {
        "state": "stated",
        "value": "14",
        "raw": "14"
      },
      "unit": {
        "state": "stated",
        "value": "sheet",
        "raw": "sht"
      },
      "unit_price": {
        "state": "stated",
        "value": "96.40",
        "raw": "$96.40"
      },
      "discount": {
        "state": "stated",
        "kind": "percent",
        "value": "10",
        "raw": "10%"
      },
      "line_total": {
        "state": "stated",
        "value": "1214.64",
        "raw": "$1,214.64"
      }
    },
    {
      "description": {
        "state": "stated",
        "value": "Formwork ply 17mm F14 2400x1200",
        "raw": "Formwork ply 17mm F14 2400x1200"
      },
      "quantity": {
        "state": "stated",
        "value": "20",
        "raw": "20"
      },
      "unit": {
        "state": "stated",
        "value": "sheet",
        "raw": "sh"
      },
      "unit_price": {
        "state": "stated",
        "value": "68.75",
        "raw": "$68.75"
      },
      "discount": {
        "state": "stated",
        "kind": "amount",
        "value": "50.00",
        "raw": "$50.00"
      },
      "line_total": {
        "state": "stated",
        "value": "1325.00",
        "raw": "$1,325.00"
      }
    },
    {
      "description": {
        "state": "stated",
        "value": "Line pump hire incl. operator (4hr)",
        "raw": "Line pump hire incl. operator (4hr)"
      },
      "quantity": {
        "state": "not_stated"
      },
      "unit": {
        "state": "stated",
        "value": "lot",
        "raw": "L/S"
      },
      "unit_price": {
        "state": "not_stated"
      },
      "discount": {
        "state": "not_stated"
      },
      "line_total": {
        "state": "stated",
        "value": "1450.00",
        "raw": "$1,450.00"
      }
    }
  ],
  "discounts": [],
  "gst": {
    "treatment": "exclusive",
    "rate": {
      "state": "stated",
      "value": "10",
      "raw": "GST 10%"
    },
    "amount": {
      "state": "stated",
      "value": "584.21",
      "raw": "$584.21"
    }
  },
  "subtotal": {
    "state": "stated",
    "value": "5842.14",
    "raw": "$5,842.14"
  },
  "total": {
    "state": "stated",
    "value": "6426.35",
    "raw": "$6,426.35"
  },
  "validity": {
    "state": "stated",
    "value": "2026-11-30",
    "raw": "valid until 30 November 2026"
  },
  "payment_terms": {
    "state": "stated",
    "value": "30 days end of month",
    "raw": "30 days end of month"
  }
}
