{
  "schema_version": "1.0.0",
  "supplier": {
    "state": "stated",
    "value": "Tōtara Bay Timber Ltd",
    "raw": "Tōtara Bay Timber Ltd"
  },
  "quote_number": {
    "state": "not_stated"
  },
  "date": {
    "state": "stated",
    "value": "2026-10-20",
    "raw": "Tue, 20 Oct 2026"
  },
  "currency": {
    "state": "not_stated"
  },
  "line_items": [
    {
      "description": {
        "state": "stated",
        "value": "H3.2 treated pine 90x45 in 4.8m lengths",
        "raw": "H3.2 treated pine 90x45 in 4.8m lengths"
      },
      "quantity": {
        "state": "stated",
        "value": "24",
        "raw": "24"
      },
      "unit": {
        "state": "stated",
        "value": "length",
        "raw": "lengths"
      },
      "unit_price": {
        "state": "stated",
        "value": "11.60",
        "raw": "$11.60 each"
      },
      "discount": {
        "state": "not_stated"
      },
      "line_total": {
        "state": "stated",
        "value": "278.40",
        "raw": "$278.40"
      }
    },
    {
      "description": {
        "state": "stated",
        "value": "decking screws",
        "raw": "decking screws"
      },
      "quantity": {
        "state": "stated",
        "value": "3",
        "raw": "three"
      },
      "unit": {
        "state": "stated",
        "value": "box",
        "raw": "boxes"
      },
      "unit_price": {
        "state": "stated",
        "value": "14.90",
        "raw": "$14.90 a box"
      },
      "discount": {
        "state": "not_stated"
      },
      "line_total": {
        "state": "stated",
        "value": "44.70",
        "raw": "$44.70"
      }
    },
    {
      "description": {
        "state": "stated",
        "value": "Delivery to site",
        "raw": "Delivery to site"
      },
      "quantity": {
        "state": "not_stated"
      },
      "unit": {
        "state": "stated",
        "value": "lot",
        "raw": "flat"
      },
      "unit_price": {
        "state": "not_stated"
      },
      "discount": {
        "state": "not_stated"
      },
      "line_total": {
        "state": "stated",
        "value": "65.00",
        "raw": "$65"
      }
    }
  ],
  "discounts": [],
  "gst": {
    "treatment": "exclusive",
    "rate": {
      "state": "not_stated"
    },
    "amount": {
      "state": "not_stated"
    }
  },
  "subtotal": {
    "state": "stated",
    "value": "388.10",
    "raw": "$388.10 all up"
  },
  "total": {
    "state": "not_stated"
  },
  "validity": {
    "state": "stated",
    "value": "2026-10-31",
    "raw": "Pricing holds until the end of this month"
  },
  "payment_terms": {
    "state": "stated",
    "value": "the 20th of the month following, and you can take 2.5% off if paid within 7 days of invoice",
    "raw": "the 20th of the month following, and you can take 2.5% off if paid within 7 days of invoice"
  }
}
