{
  "schema_version": "1.0.0",
  "supplier": {
    "state": "stated",
    "value": "HARROWGATE INSTRUMENTS INC.",
    "raw": "HARROWGATE INSTRUMENTS INC."
  },
  "quote_number": {
    "state": "stated",
    "value": "HI-26-1015-B",
    "raw": "HI-26-1015-B"
  },
  "date": {
    "state": "stated",
    "value": "2026-10-15",
    "raw": "October 15, 2026"
  },
  "currency": {
    "state": "stated",
    "value": "USD",
    "raw": "US$"
  },
  "line_items": [
    {
      "description": {
        "state": "stated",
        "value": "Digital multimeter, CAT IV",
        "raw": "Digital multimeter, CAT IV"
      },
      "quantity": {
        "state": "stated",
        "value": "4",
        "raw": "4"
      },
      "unit": {
        "state": "stated",
        "value": "each",
        "raw": "ea"
      },
      "unit_price": {
        "state": "stated",
        "value": "142.00",
        "raw": "142.00"
      },
      "discount": {
        "state": "not_stated"
      },
      "line_total": {
        "state": "stated",
        "value": "568.00",
        "raw": "568.00"
      }
    },
    {
      "description": {
        "state": "stated",
        "value": "Test leads kit",
        "raw": "Test leads kit"
      },
      "quantity": {
        "state": "stated",
        "value": "4",
        "raw": "4"
      },
      "unit": {
        "state": "stated",
        "value": "each",
        "raw": "ea"
      },
      "unit_price": {
        "state": "stated",
        "value": "18.75",
        "raw": "18.75"
      },
      "discount": {
        "state": "not_stated"
      },
      "line_total": {
        "state": "stated",
        "value": "76.00",
        "raw": "76.00"
      }
    },
    {
      "description": {
        "state": "stated",
        "value": "Hard carry case",
        "raw": "Hard carry case"
      },
      "quantity": {
        "state": "stated",
        "value": "4",
        "raw": "4"
      },
      "unit": {
        "state": "stated",
        "value": "each",
        "raw": "ea"
      },
      "unit_price": {
        "state": "stated",
        "value": "0.00",
        "raw": "FOC"
      },
      "discount": {
        "state": "not_stated"
      },
      "line_total": {
        "state": "stated",
        "value": "0.00",
        "raw": "0.00"
      }
    },
    {
      "description": {
        "state": "stated",
        "value": "Credit: return of old DM-200",
        "raw": "Credit: return of old DM-200"
      },
      "quantity": {
        "state": "stated",
        "value": "2",
        "raw": "2"
      },
      "unit": {
        "state": "stated",
        "value": "each",
        "raw": "ea"
      },
      "unit_price": {
        "state": "stated",
        "value": "-40.00",
        "raw": "-40.00"
      },
      "discount": {
        "state": "not_stated"
      },
      "line_total": {
        "state": "stated",
        "value": "-80.00",
        "raw": "-80.00"
      }
    },
    {
      "description": {
        "state": "stated",
        "value": "Freight (DHL Express)",
        "raw": "Freight (DHL Express)"
      },
      "quantity": {
        "state": "stated",
        "value": "1",
        "raw": "1"
      },
      "unit": {
        "state": "not_stated"
      },
      "unit_price": {
        "state": "stated",
        "value": "45.00",
        "raw": "45.00"
      },
      "discount": {
        "state": "not_stated"
      },
      "line_total": {
        "state": "stated",
        "value": "45.00",
        "raw": "45.00"
      }
    }
  ],
  "discounts": [],
  "gst": {
    "treatment": "not_charged",
    "rate": {
      "state": "not_stated"
    },
    "amount": {
      "state": "not_stated"
    }
  },
  "subtotal": {
    "state": "stated",
    "value": "609.00",
    "raw": "609.00"
  },
  "total": {
    "state": "stated",
    "value": "609.00",
    "raw": "609.00"
  },
  "validity": {
    "state": "stated",
    "value": "P60D",
    "raw": "60 days"
  },
  "payment_terms": {
    "state": "stated",
    "value": "100% t/t in advance",
    "raw": "100% T/T in advance"
  }
}
